{
  "$schema": "https://json-schema.org/draft/2020-12/schema",
  "type": "object",
  "required": [
    "asset_id",
    "integrity_ok",
    "entity_id",
    "authority_id",
    "action",
    "resource"
  ],
  "properties": {
    "asset_id": {
      "type": "string",
      "minLength": 1
    },
    "integrity_ok": {
      "type": "boolean"
    },
    "entity_id": {
      "type": "string",
      "minLength": 1
    },
    "authority_id": {
      "type": "string",
      "minLength": 1
    },
    "issuer_id": {
      "type": [
        "string",
        "null"
      ]
    },
    "action": {
      "type": "string",
      "minLength": 1
    },
    "resource": {
      "type": "string",
      "minLength": 1
    },
    "context": {
      "type": "object",
      "default": {}
    },
    "process_evidence": {
      "type": [
        "object",
        "null"
      ],
      "properties": {
        "verified": {
          "type": "boolean"
        },
        "process_type": {
          "type": "string"
        },
        "confidence": {
          "type": "number"
        },
        "evidence_ref": {
          "type": "string"
        },
        "evidence_format": {
          "type": "string"
        },
        "appraisal": {
          "type": "string"
        },
        "reference": {
          "type": "string"
        }
      },
      "additionalProperties": true
    }
  },
  "$id": "https://example.org/cawg-trqp/schemas/verification-request.schema.json",
  "additionalProperties": true
}
